Proposed Edit,Incorrect Sentence,Correct Sentence,True Label (Multi-Class),"Edit Quality (g,b,a)","Edit Extraction Quality (a,b)"
"Orig: [4, 5, ['गया']], Cor: [4, 5, ['गए']], Type: 'R:OTHER'","उन्हें दो रन मिल गया।
","उन्हें दो रन मिल गए।
",R:VERB-NUM,a,a
"Orig: [3, 4, ['होता']], Cor: [3, 4, ['होते']], Type: 'R:OTHER'","इसमें पैसे खर्च होता है।
","इसमें पैसे खर्च होते हैं।
",R:VERB-NUM,a,a
"Orig: [4, 5, ['है']], Cor: [4, 5, ['हैं']], Type: 'R:OTHER'","इसमें पैसे खर्च होता है।
","इसमें पैसे खर्च होते हैं।
",R:VERB-NUM,a,a
"Orig: [4, 5, ['गई']], Cor: [4, 5, ['गया']], Type: 'R:OTHER'","लगता है मानसून आ गई।
","लगता है मानसून आ गया।
",R:VERB-GEN,a,a
"Orig: [4, 5, ['रही']], Cor: [4, 5, ['रहे']], Type: 'R:OTHER'","लड़के और लड़कियाँ पढ़ रही हैं।
","लड़के और लड़कियाँ पढ़ रहे हैं।
",R:VERB-NUM,a,a
"Orig: [4, 5, ['आँख']], Cor: [4, 5, ['आँखें']], Type: 'R:NOUN-NUM'","रामचरितमानस पढ़कर पाठक की आँख खुल गई।
","रामचरितमानस पढ़कर पाठक की आँखें खुल गईं।
",R:NOUN-NUM,g,a
"Orig: [6, 7, ['गई']], Cor: [6, 7, ['गईं']], Type: 'R:OTHER'","रामचरितमानस पढ़कर पाठक की आँख खुल गई।
","रामचरितमानस पढ़कर पाठक की आँखें खुल गईं।
",R:VERB-NUM,a,a
"Orig: [2, 3, ['आँख']], Cor: [2, 3, ['आँखों']], Type: 'R:NOUN-NUM'","सीता की आँख से आँसू बह रहा है।
","सीता की आँखों से आँसू बह रहे हैं।
",R:NOUN-NUM,g,a
"Orig: [6, 7, ['रहा']], Cor: [6, 7, ['रहे']], Type: 'R:OTHER'","सीता की आँख से आँसू बह रहा है।
","सीता की आँखों से आँसू बह रहे हैं।
",R:VERB-NUM,a,a
"Orig: [7, 8, ['है']], Cor: [7, 8, ['हैं']], Type: 'R:OTHER'","सीता की आँख से आँसू बह रहा है।
","सीता की आँखों से आँसू बह रहे हैं।
",R:VERB-NUM,a,a
"Orig: [0, 1, ['अनेकों']], Cor: [0, 1, ['अनेक']], Type: 'R:OTHER'","अनेकों स्त्री-पुरुष वहाँ आए थे।
","अनेक स्त्री-पुरुष वहाँ आए थे।
",R:ADJ-NUM,b,a
"Orig: [2, 3, ['जोड़ा']], Cor: [2, 3, ['जोड़े']], Type: 'R:OTHER'","उन्होंने हाथ जोड़ा।
","उन्होंने हाथ जोड़े।
",R:VERB-NUM,a,a
"Orig: [3, 4, ['आएँगे']], Cor: [3, 4, ['आएगा']], Type: 'R:OTHER'","हर एक आदमी आएँगे।
","हर एक आदमी आएगा।
",R:VERB-NUM,a,a
"Orig: [3, 4, ['सोने']], Cor: [3, 4, ['सोना']], Type: 'R:ADJ'","उनके पास बहुत सोने हैं।
","उनके पास बहुत सोना है।
",R:NOUN-NUM,b,a
"Orig: [4, 5, ['हैं']], Cor: [4, 5, ['है']], Type: 'R:OTHER'","उनके पास बहुत सोने हैं।
","उनके पास बहुत सोना है।
",R:VERB-NUM,a,a
"Orig: [1, 2, ['पीतले']], Cor: [1, 2, ['पीतल']], Type: 'R:SPELL'","मैंने पीतले खरीदे।
","मैंने पीतल खरीदा।
",R:SPELL,g,a
"Orig: [2, 3, ['खरीदे']], Cor: [2, 3, ['खरीदा']], Type: 'R:OTHER'","मैंने पीतले खरीदे।
","मैंने पीतल खरीदा।
",R:VERB-NUM,a,a
"Orig: [2, 3, ['बुरे']], Cor: [2, 3, ['बुरा']], Type: 'R:OTHER'","प्रत्येक चित्र बुरे नहीं होते।
","प्रत्येक चित्र बुरा नहीं होता।
",R:ADJ-NUM,b,a
"Orig: [4, 5, ['होते']], Cor: [4, 5, ['होता']], Type: 'R:OTHER'","प्रत्येक चित्र बुरे नहीं होते।
","प्रत्येक चित्र बुरा नहीं होता।
",R:VERB-NUM,a,a
"Orig: [6, 9, ['फूलों', 'को', 'देखा']], Cor: [6, 8, ['फूल', 'देखे']], Type: 'R:OTHER'","गुलाब के पौधे पर मैंने कई फूलों को देखा।
","गुलाब के पौधे पर मैंने कई फूल देखे।
",R:OTHER,g,a
"Orig: [1, 2, ['इसका']], Cor: [1, 2, ['इसके']], Type: 'R:PRON'","तुम इसका दाम देते जाओ।
","तुम इसके दाम देते जाओ।
",R:PRON-NUM,g,a
"Orig: [1, 2, ['कई']], Cor: [1, 1, []], Type: 'U:OTHER'","डाकू कई हज़ारों रुपये लूट कर ले गए।
","डाकू हज़ारों रुपये लूट कर ले गए।
",U:ADJ,b,a
"Orig: [1, 2, ['आपका']], Cor: [1, 2, ['आपके']], Type: 'R:PRON'","मैं आपका दर्शन करने आया हूँ।
","मैं आपके दर्शन करने आया हूँ।
",R:PRON-NUM,g,a
"Orig: [2, 3, ['के']], Cor: [2, 3, ['का']], Type: 'R:ADP'","इस कलम के दाम मिल गए हैं।
","इस कलम का दाम मिल गया है।
",R:ADP,g,a
"Orig: [5, 6, ['गए']], Cor: [5, 6, ['गया']], Type: 'R:OTHER'","इस कलम के दाम मिल गए हैं।
","इस कलम का दाम मिल गया है।
",R:VERB-NUM,a,a
"Orig: [6, 7, ['हैं']], Cor: [6, 7, ['है']], Type: 'R:OTHER'","इस कलम के दाम मिल गए हैं।
","इस कलम का दाम मिल गया है।
",R:VERB-NUM,a,a
"Orig: [2, 3, ['वर्षाएँ']], Cor: [2, 3, ['वर्षा']], Type: 'R:NOUN:INFL'","आजकल खूब वर्षाएँ हो रही हैं।
","आजकल खूब वर्षा हो रही है।
",R:NOUN-NUM,b,a
"Orig: [5, 6, ['हैं']], Cor: [5, 6, ['है']], Type: 'R:OTHER'","आजकल खूब वर्षाएँ हो रही हैं।
","आजकल खूब वर्षा हो रही है।
",R:VERB-NUM,a,a
"Orig: [1, 2, ['लड़की']], Cor: [1, 2, ['लड़कियाँ']], Type: 'R:OTHER'","दो लड़की चित्र बना रही हैं।
","दो लड़कियाँ चित्र बना रही हैं।
",R:NOUN-NUM,b,a
"Orig: [3, 4, ['जोड़ा']], Cor: [3, 4, ['जोड़े']], Type: 'R:OTHER'","मोहन ने हाथ जोड़ा।
","मोहन ने हाथ जोड़े।
",R:VERB-NUM,a,a
"Orig: [3, 4, ['सकेंगे']], Cor: [3, 4, ['सकोगे']], Type: 'R:OTHER'","क्या आप जा सकेंगे ?
","क्या आप जा सकोगे ?
",R:VERB,a,a
"Orig: [1, 2, ['का']], Cor: [1, 2, ['के']], Type: 'R:ADP'","मोहन का प्राण निकलने वाला है।
","मोहन के प्राण निकलने वाले हैं।
",R:ADP,g,a
"Orig: [4, 5, ['वाला']], Cor: [4, 5, ['वाले']], Type: 'R:OTHER'","मोहन का प्राण निकलने वाला है।
","मोहन के प्राण निकलने वाले हैं।
",R:OTHER,g,a
"Orig: [5, 6, ['है']], Cor: [5, 6, ['हैं']], Type: 'R:OTHER'","मोहन का प्राण निकलने वाला है।
","मोहन के प्राण निकलने वाले हैं।
",R:VERB,a,a
"Orig: [1, 2, ['इस']], Cor: [1, 2, ['इन']], Type: 'R:OTHER'","लोग इस फूल की माला पहनते हैं।
","लोग इन फूलों की माला पहनते हैं।
",R:OTHER,g,a
"Orig: [2, 3, ['फूल']], Cor: [2, 3, ['फूलों']], Type: 'R:NOUN-NUM'","लोग इस फूल की माला पहनते हैं।
","लोग इन फूलों की माला पहनते हैं।
",R:NOUN-NUM,g,a
"Orig: [3, 4, ['दिया']], Cor: [3, 4, ['दिए']], Type: 'R:OTHER'","उसने हस्ताक्षर कर दिया।
","उसने हस्ताक्षर कर दिए।
",R:VERB-NUM,a,a
"Orig: [2, 3, ['अनेकों']], Cor: [2, 3, ['अनेक']], Type: 'R:OTHER'","सभा में अनेकों विद्वान आए थे।
","सभा में अनेक विद्वान आए थे।
",R:ADJ-NUM,b,a
"Orig: [1, 2, ['आप']], Cor: [1, 2, ['आपने']], Type: 'R:PRON'","क्या आप खा लिये हैं?
","क्या आपने खा लिया है?
",R:PRON,g,a
"Orig: [3, 4, ['लिये']], Cor: [3, 4, ['लिया']], Type: 'R:OTHER'","क्या आप खा लिये हैं?
","क्या आपने खा लिया है?
",R:VERB-NUM,a,a
"Orig: [4, 5, ['हैं']], Cor: [4, 5, ['है']], Type: 'R:OTHER'","क्या आप खा लिये हैं?
","क्या आपने खा लिया है?
",R:VERB-NUM,a,a
"Orig: [2, 3, ['बच्चा']], Cor: [2, 3, ['बच्चे']], Type: 'R:NOUN-NUM'","मेले में बच्चा खो गया।
","मेले में बच्चे खो गया।
",R:NOUN-NUM,g,a
"Orig: [1, 2, ['सब']], Cor: [1, 2, ['सबों']], Type: 'R:NOUN-GEN'","इन सब को जाना है।
","इन सबों को जाना है।
",R:PRON-NUM,b,a
"Orig: [1, 2, ['कितने']], Cor: [1, 2, ['कितना']], Type: 'R:OTHER'",उसे कितने संतरे चाहिए।,उसे कितना संतरे चाहिए।,R:OTHER,g,a