,Proposed Edit InHerrant,Proposed Edit Ankur's Errant,Incorrect Sentence,Correct Sentence,True Label Before (Multi-Class),True Label (Multi-Class),"Edit Quality (g,b,a)","Edit Extraction Quality (a,b)",InHerrant Annotation Correct,"Edit Quality (g,b,a) Ankur",Ankur Annotation Correct
0,"Orig: [0, 2, ['गाय', 'काली']], Cor: [0, 2, ['काली', 'गाय']], Type: 'R:WO'","Orig: [0, 2, 'गाय काली'], Cor: [0, 2, 'काली गाय'], Type: 'R:WO'","गाय काली चर रही है।
","काली गाय चर रही है।
",R:WO,R:WO,g,a,YES,g,NO
1,"Orig: [0, 2, ['हवा', 'ठंडी']], Cor: [0, 2, ['ठंडी', 'हवा']], Type: 'R:WO'","Orig: [0, 2, 'हवा ठंडी'], Cor: [0, 2, 'ठंडी हवा'], Type: 'R:WO'","हवा ठंडी बह रही थी। 
","ठंडी हवा बह रही थी।
",R:WO,R:WO,g,a,YES,g,NO
2,"Orig: [3, 4, ['बड़ी-बड़ी']], Cor: [3, 4, ['बड़े-बड़े']], Type: 'R:SPELL'","Orig: [3, 4, 'बड़ी-बड़ी'], Cor: [3, 4, 'बड़े-बड़े'], Type: 'R:SPELL'","मुंबई में मैंने बड़ी-बड़ी होटलें देखी।
","मुंबई में मैंने बड़े-बड़े होटल देखे।
",R:ADJ-NUM,R:SPELL,b,a,NO,b,NO
3,"Orig: [4, 5, ['होटलें']], Cor: [4, 5, ['होटल']], Type: 'R:SPELL'","Orig: [4, 5, 'होटलें'], Cor: [4, 5, 'होटल'], Type: 'R:SPELL'","मुंबई में मैंने बड़ी-बड़ी होटलें देखी।
","मुंबई में मैंने बड़े-बड़े होटल देखे।
",R:NOUN-NUM,R:SPELL,b,a,NO,b,NO
4,"Orig: [5, 6, ['देखी']], Cor: [5, 6, ['देखे']], Type: 'R:VERB-GEN'","Orig: [5, 6, 'देखी।'], Cor: [5, 6, 'देखे।'], Type: 'R:SPELL'","मुंबई में मैंने बड़ी-बड़ी होटलें देखी।
","मुंबई में मैंने बड़े-बड़े होटल देखे।
",R:VERB-GEN,R:VERB-GEN,g,a,YES,g,NO
5,"Orig: [1, 2, ['बड़ा-सा']], Cor: [1, 2, ['बड़ी-सी']], Type: 'R:SPELL'","Orig: [1, 2, 'बड़ा-सा'], Cor: [1, 2, 'बड़ी-सी'], Type: 'R:SPELL'","एक बड़ा-सा कील लाओ।
","एक बड़ी-सी कील लाओ।
",R:ADJ-GEN,R:SPELL,b,a,NO,b,NO
6,"Orig: [2, 3, ['ताज़ी']], Cor: [2, 3, ['ताज़ा']], Type: 'R:SPELL'","Orig: [2, 3, 'ताज़ी'], Cor: [2, 3, 'ताज़ा'], Type: 'R:MORPH'","आज की ताज़ी खबरें सुनो।
","आज की ताज़ा खबरें सुनो।
",R:ADJ-GEN,R:SPELL,b,a,NO,b,NO
7,"Orig: [1, 2, ['की']], Cor: [1, 2, ['का']], Type: 'R:ADP-INFL'","Orig: [1, 2, 'की'], Cor: [1, 2, 'का'], Type: 'R:ADP:INFL'","दहेज की लेन-देन बहुत बुरी रिवाज़ है।
","दहेज का लेन-देन बहुत बुरा रिवाज़ है।
",R:ADP,R:ADP-INFL,g,a,NO,g,YES
8,"Orig: [4, 5, ['बुरी']], Cor: [4, 5, ['बुरा']], Type: 'R:ADJ-GEN'","Orig: [4, 5, 'बुरी'], Cor: [4, 5, 'बुरा'], Type: 'R:ADJ:INFL'","दहेज की लेन-देन बहुत बुरी रिवाज़ है।
","दहेज का लेन-देन बहुत बुरा रिवाज़ है।
",R:ADJ-GEN,R:ADJ-GEN,g,a,YES,a,YES
9,"Orig: [4, 5, ['विशाल']], Cor: [4, 5, ['तेज़']], Type: 'R:ADJ'","Orig: [4, 5, 'विशाल'], Cor: [4, 5, 'तेज़'], Type: 'R:ADJ'","मोहन की बुद्धि बड़ी विशाल है।
","मोहन की बुद्धि बड़ी तेज़ है।
",R:ADJ,R:ADJ,g,a,YES,g,NO
10,"Orig: [4, 5, ['घोर']], Cor: [4, 5, ['घनिष्ठ']], Type: 'R:ADJ'","Orig: [4, 5, 'घोर'], Cor: [4, 5, 'घनिष्ठ'], Type: 'R:ADJ'","साहित्य और जीवन का घोर संबंध है।
","साहित्य और जीवन का घनिष्ठ संबंध है।
",R:ADJ,R:ADJ,g,a,YES,g,NO
11,"Orig: [2, 3, ['वीभत्स']], Cor: [2, 3, ['भयानक']], Type: 'R:ADJ'","Orig: [2, 3, 'वीभत्स'], Cor: [2, 3, 'भयानक'], Type: 'R:ADJ'","सिंह एक वीभत्स जानवर है।
","सिंह एक भयानक जानवर है।
",R:ADJ,R:ADJ,g,a,YES,g,NO
12,"Orig: [2, 3, ['तीब्र']], Cor: [2, 3, ['अधिक']], Type: 'R:OTHER'","Orig: [2, 3, 'तीब्र'], Cor: [2, 3, 'अधिक'], Type: 'R:OTHER'","शीला के तीब्र आग्रह करने पर मैं उसके घर गई।
","शीला के अधिक आग्रह करने पर मैं उसके घर गई।
",R:ADJ,R:OTHER,b,a,NO,b,NO
13,"Orig: [1, 2, ['बुद्धि']], Cor: [1, 2, ['बुदृधि']], Type: 'R:NOUN'","Orig: [1, 2, 'बुद्धि'], Cor: [1, 2, 'बुदृधि'], Type: 'R:NOUN'","उसकी बुद्धि बड़ी विशाल है।
","उसकी बुदृधि बड़ी सूक्ष्म है।
",,R:NOUN,,,NO,,NO
14,"Orig: [3, 4, ['विशाल']], Cor: [3, 4, ['सूक्ष्म']], Type: 'R:ADJ'","Orig: [3, 4, 'विशाल'], Cor: [3, 4, 'सूक्ष्म'], Type: 'R:ADJ'","उसकी बुद्धि बड़ी विशाल है।
","उसकी बुदृधि बड़ी सूक्ष्म है।
",R:ADJ,R:ADJ,g,a,YES,g,NO
15,"Orig: [3, 4, ['सबसे']], Cor: [3, 4, ['अधिक']], Type: 'R:OTHER'","Orig: [3, 4, 'सबसे'], Cor: [3, 4, 'अधिक'], Type: 'R:OTHER'","तुम दोनों में सबसे बुद्धिमान कौन है ?
","तुम दोनों में अधिक बुद्धिमान कौन है ?
",R:ADV,R:OTHER,b,a,NO,b,NO
16,"Orig: [6, 7, ['बड़ाईपन']], Cor: [6, 7, ['बड़प्पन']], Type: 'R:SPELL'","Orig: [6, 7, 'बड़ाईपन'], Cor: [6, 7, 'बड़प्पन'], Type: 'R:SPELL'","किसी को क्षमा करने में ही बड़ाईपन है।
","किसी को क्षमा करने में ही बड़प्पन है।
",R:SPELL,R:SPELL,g,a,YES,g,NO
17,"Orig: [2, 3, ['दहाड़']], Cor: [2, 3, ['चिंघाड़']], Type: 'R:SPELL'","Orig: [2, 3, 'दहाड़'], Cor: [2, 3, 'चिंघाड़'], Type: 'R:NOUN'","हाथियों की दहाड़ सुनकर हम डर गए।
","हाथियों की चिंघाड़ सुनकर हम डर गए।
",R:NOUN,R:SPELL,g,a,NO,g,NO
18,"Orig: [2, 3, ['मोटी']], Cor: [2, 3, ['मोटा']], Type: 'R:ADJ-GEN'","Orig: [2, 3, 'मोटी'], Cor: [2, 3, 'मोटा'], Type: 'R:ADJ:INFL'","हाथी बहुत मोटी है।
","हाथी बहुत मोटा है।
",R:ADJ-GEN,R:ADJ-GEN,g,a,YES,a,YES
19,"Orig: [2, 3, ['नई']], Cor: [2, 3, ['नया']], Type: 'R:ADJ-GEN'","Orig: [2, 3, 'नई'], Cor: [2, 3, 'नया'], Type: 'R:ADJ:INFL'","राम ने नई कपड़ा खरीदी।
","राम ने नया कपड़ा खरीदा।
",R:ADJ-GEN,R:ADJ-GEN,g,a,YES,a,YES
20,"Orig: [4, 5, ['खरीदी']], Cor: [4, 5, ['खरीदा']], Type: 'R:VERB-GEN'","Orig: [4, 5, 'खरीदी।'], Cor: [4, 5, 'खरीदा।'], Type: 'R:SPELL'","राम ने नई कपड़ा खरीदी।
","राम ने नया कपड़ा खरीदा।
",R:VERB-GEN,R:VERB-GEN,g,a,YES,g,NO
21,"Orig: [2, 3, ['श्रेष्ठतम']], Cor: [2, 3, ['श्रेष्ठ']], Type: 'R:ADJ'","Orig: [2, 3, 'श्रेष्ठतम'], Cor: [2, 3, 'श्रेष्ठ'], Type: 'R:ADJ:INFL'","आपकी रचना श्रेष्ठतम है।
","आपकी रचना श्रेष्ठ है।
",R:ADJ,R:ADJ,g,a,YES,g,NO
22,"Orig: [1, 2, ['मोटे-मोटे']], Cor: [1, 2, ['बड़े-बड़े']], Type: 'R:ADJ'","Orig: [1, 2, 'मोटे-मोटे'], Cor: [1, 2, 'बड़े-बड़े'], Type: 'R:OTHER'","उसने मोटे-मोटे फल छाँट लिए।
","उसने बड़े-बड़े फल छाँट लिए।
",R:ADJ,R:ADJ,g,a,YES,g,NO
23,"Orig: [2, 3, ['विचित्र']], Cor: [2, 3, ['अद्भुत']], Type: 'R:ADJ'","Orig: [2, 3, 'विचित्र'], Cor: [2, 3, 'अद्भुत'], Type: 'R:ADJ'","ताजमहल एक विचित्र मीनार है।
","ताजमहल एक अद्भुत मीनार है।
",R:ADJ,R:ADJ,g,a,YES,g,NO
24,"Orig: [3, 4, ['भारी']], Cor: [3, 4, ['बहुत']], Type: 'R:OTHER'","Orig: [3, 4, 'भारी'], Cor: [3, 4, 'बहुत'], Type: 'R:OTHER'","करन की माँ भारी दुखी है।
","करन की माँ बहुत दुखी है।
",R:ADV,R:OTHER,g,a,NO,g,NO
25,"Orig: [2, 3, ['उच्च']], Cor: [2, 3, ['विशाल']], Type: 'R:ADJ'","Orig: [2, 3, 'उच्च'], Cor: [2, 3, 'विशाल'], Type: 'R:ADJ'","आकाश बहुत उच्च है।
","आकाश बहुत विशाल है।
",R:ADJ,R:ADJ,g,a,YES,g,NO
26,"Orig: [2, 3, ['अपने']], Cor: [2, 3, ['नियत']], Type: 'R:OTHER'","Orig: [2, 3, 'अपने'], Cor: [2, 3, 'नियत'], Type: 'R:OTHER'","प्रत्येक काम अपने समय पर करो।
","प्रत्येक काम नियत समय पर करो।
",R:ADJ,R:OTHER,g,a,NO,g,NO
27,"Orig: [2, 3, ['विख्यात']], Cor: [2, 3, ['कुख्यात']], Type: 'R:ADJ'","Orig: [2, 3, 'विख्यात'], Cor: [2, 3, 'कुख्यात'], Type: 'R:ADJ'","खड़ग सिंह विख्यात डाकू था।
","खड़ग सिंह कुख्यात डाकू था।
",R:ADJ,R:ADJ,g,a,YES,g,NO
28,"Orig: [2, 3, ['वीभत्स']], Cor: [2, 3, ['भयानक']], Type: 'R:ADJ'","Orig: [2, 3, 'वीभत्स'], Cor: [2, 3, 'भयानक'], Type: 'R:ADJ'","शेर बड़ा वीभत्स होता है।
","शेर बड़ा भयानक होता है।
",R:ADJ,R:ADJ,g,a,YES,g,NO
29,"Orig: [2, 3, ['के']], Cor: [2, 3, ['की']], Type: 'R:ADP-INFL'","Orig: [2, 3, 'के'], Cor: [2, 3, 'की'], Type: 'R:ADP:INFL'",पुस्तकालय सड़क के बायाँ ओर है।,पुस्तकालय सड़क की बाईं ओर है।,R:ADV,R:ADP-INFL,g,a,NO,g,YES
30,"Orig: [3, 4, ['बायाँ']], Cor: [3, 4, ['बाईं']], Type: 'R:OTHER'","Orig: [3, 4, 'बायाँ'], Cor: [3, 4, 'बाईं'], Type: 'R:NOUN'",पुस्तकालय सड़क के बायाँ ओर है।,पुस्तकालय सड़क की बाईं ओर है।,R:ADJ-GEN,R:OTHER,a,a,NO,a,NO
