,Proposed Edit,Incorrect Sentence,Correct Sentence
0,"Orig: [1, 1, []], Cor: [1, 2, ['ने']], Type: 'M:ADP'","राकेश कुत्ते को पीटा।
","राकेश ने कुत्ते को पीटा।
"
1,"Orig: [0, 1, ['मैंने']], Cor: [0, 1, ['मुझे']], Type: 'R:PRON'","मैंने यह काम नहीं करना।
","मुझे यह काम नहीं करना।
"
2,"Orig: [0, 2, ['मेरे', 'को']], Cor: [0, 1, ['मुझे']], Type: 'R:OTHER'","मेरे को पता नहीं है।
","मुझे पता नहीं है।
"
3,"Orig: [1, 2, ['हमारे']], Cor: [1, 2, ['अपने']], Type: 'R:PRON'","हम हमारे घर जा रहे हैं।
","हम अपने घर जा रहे हैं।
"
4,"Orig: [1, 2, ['मेरा']], Cor: [1, 2, ['अपना']], Type: 'R:PRON'","मैं मेरा काम जानता हूँ।
","मैं अपना काम जानता हूँ।
"
5,"Orig: [3, 5, ['के', 'लिए']], Cor: [3, 4, ['को']], Type: 'R:ADP'","लड़कों से जाने के लिए कहो।
","लड़कों से जाने को कहो।
"
6,"Orig: [2, 3, ['में']], Cor: [2, 3, ['पर']], Type: 'R:ADP'",वे मुझ में विश्वास करते हैं।,"वे मुझ पर विश्वास करते हैं।
"
